{
  "version": "0.1.0",
  "decision_id": "gov_decision_allow_demo",
  "request_id": "req_search_patient_context_demo",
  "actor_ref": "app_scribe",
  "organization_ref": "org_voither_demo",
  "patient_ref": "patient_demo_001",
  "purpose": "clinical_documentation",
  "decision": "allow",
  "allowed": true,
  "data_classes": [
    "transcript",
    "clinical_artifact",
    "governed_projection"
  ],
  "permitted_outputs": [
    "governed_context_summary",
    "supporting_artifact_refs"
  ],
  "consent_scope": "consent_clinical_documentation_active",
  "reidentification_allowed": false,
  "model_use_allowed": true,
  "remote_model_allowed": false,
  "requires_audit": true,
  "requires_provenance": true,
  "requires_human_approval": false,
  "reason": "Allowed for clinical documentation with data minimization, no reidentification, and no remote model use.",
  "constraints": [
    "data_minimization",
    "governed_projection_only",
    "no_remote_model",
    "no_reidentification"
  ],
  "created_at": "2026-06-01T00:00:00Z"
}
